[
 {
  "form": "카",
  "pos": "affix",
  "gloss": "evidential: direct",
  "sense_notes": "Speaker witnessed it. Mandatory slot; scopes over negation (D30).",
  "id": "w0001",
  "added": "2026-09-14"
 },
 {
  "form": "케",
  "pos": "affix",
  "gloss": "evidential: reported",
  "sense_notes": "Speaker was told it. Source is someone else's statement.",
  "id": "w0002",
  "added": "2026-09-14"
 },
 {
  "form": "키",
  "pos": "affix",
  "gloss": "evidential: inferred",
  "sense_notes": "Speaker reasoned it out from evidence, did not witness it.",
  "id": "w0003",
  "added": "2026-09-14"
 },
 {
  "form": "코",
  "pos": "affix",
  "gloss": "evidential: general",
  "sense_notes": "Known without a source: definition, convention, common knowledge.",
  "id": "w0004",
  "added": "2026-09-14"
 },
 {
  "form": "마",
  "pos": "affix",
  "gloss": "stance: intend",
  "sense_notes": "Speaker is committed to doing it. The commitment half of English 'will' (D31).",
  "id": "w0005",
  "added": "2026-09-14"
 },
 {
  "form": "매",
  "pos": "affix",
  "gloss": "stance: predict",
  "sense_notes": "Speaker expects it, without commitment. The prediction half of English 'will'.",
  "id": "w0006",
  "added": "2026-09-14"
 },
 {
  "form": "메",
  "pos": "affix",
  "gloss": "stance: propose",
  "sense_notes": "Offered for testing or discussion, not claimed. A hypothesis, never a finding (D34).",
  "id": "w0007",
  "added": "2026-09-14"
 },
 {
  "form": "미",
  "pos": "affix",
  "gloss": "stance: trust",
  "sense_notes": "Speaker relies on it as an assumption; the thing being built on.",
  "id": "w0008",
  "added": "2026-09-14"
 },
 {
  "form": "모",
  "pos": "affix",
  "gloss": "stance: risk",
  "sense_notes": "Speaker knows it may go wrong and says so.",
  "id": "w0009",
  "added": "2026-09-14"
 },
 {
  "form": "무",
  "pos": "affix",
  "gloss": "stance: assert",
  "sense_notes": "Speaker insists, against pushback. Carries emphasis (D32).",
  "id": "w0010",
  "added": "2026-09-14"
 },
 {
  "form": "타",
  "pos": "affix",
  "gloss": "tense: past",
  "sense_notes": "Before now. Present is unmarked.",
  "id": "w0011",
  "added": "2026-09-14"
 },
 {
  "form": "투",
  "pos": "affix",
  "gloss": "tense: future",
  "sense_notes": "After now, strictly temporal; intention and prediction are stance (D31).",
  "id": "w0012",
  "added": "2026-09-14"
 },
 {
  "form": "루",
  "pos": "affix",
  "gloss": "negation",
  "sense_notes": "Piece of the verb ending, before tense. Evidential scopes over it (D32).",
  "id": "w0013",
  "added": "2026-09-14"
 },
 {
  "form": "디",
  "pos": "affix",
  "gloss": "subordinator",
  "sense_notes": "Last piece of the embedded verb's ending; makes a clause a complement or a relative clause (D33).",
  "id": "w0014",
  "added": "2026-09-14"
 },
 {
  "form": "파",
  "pos": "func",
  "gloss": "case: object",
  "sense_notes": "On the argument acted on. Subject is bare.",
  "id": "w0015",
  "added": "2026-09-14"
 },
 {
  "form": "페",
  "pos": "func",
  "gloss": "case: location",
  "sense_notes": "On the argument that is a place, source or goal of location.",
  "id": "w0016",
  "added": "2026-09-14"
 },
 {
  "form": "피",
  "pos": "func",
  "gloss": "case: possessor",
  "sense_notes": "On the possessor, which precedes the possessed.",
  "id": "w0017",
  "added": "2026-09-14"
 },
 {
  "form": "추",
  "pos": "func",
  "gloss": "question particle",
  "sense_notes": "Sentence-final. The answer supplies the evidential (D30, D33).",
  "id": "w0018",
  "added": "2026-09-14"
 },
 {
  "form": "아",
  "pos": "func",
  "gloss": "pronoun: I",
  "sense_notes": "Speaker. Takes case markers, nothing else.",
  "id": "w0019",
  "added": "2026-09-14"
 },
 {
  "form": "에",
  "pos": "func",
  "gloss": "pronoun: you",
  "sense_notes": "Addressee.",
  "id": "w0020",
  "added": "2026-09-14"
 },
 {
  "form": "이",
  "pos": "func",
  "gloss": "pronoun: this one",
  "sense_notes": "Near or just mentioned; person or thing. No gender, no animacy.",
  "id": "w0021",
  "added": "2026-09-14"
 },
 {
  "form": "우",
  "pos": "func",
  "gloss": "pronoun: that one",
  "sense_notes": "Far or earlier mentioned; person or thing.",
  "id": "w0022",
  "added": "2026-09-14"
 },
 {
  "form": "하",
  "pos": "func",
  "gloss": "relational: with",
  "sense_notes": "Accompaniment or instrument. Separate word after its argument.",
  "id": "w0023",
  "added": "2026-09-14"
 },
 {
  "form": "헤",
  "pos": "func",
  "gloss": "relational: for",
  "sense_notes": "Beneficiary or purpose.",
  "id": "w0024",
  "added": "2026-09-14"
 },
 {
  "form": "호",
  "pos": "func",
  "gloss": "relational: from",
  "sense_notes": "Origin, cause or source, when the location case is not enough.",
  "id": "w0025",
  "added": "2026-09-14"
 },
 {
  "form": "사",
  "pos": "root",
  "gloss": "know by test",
  "sense_notes": "Knowing carve, side 1 of 3: known because it was tried or observed to hold. Not by definition (side 2), not belief (side 3). As an argument: a tested fact.",
  "id": "w0026",
  "added": "2026-09-14"
 },
 {
  "form": "세",
  "pos": "root",
  "gloss": "know by definition",
  "sense_notes": "Knowing carve, side 2 of 3: known because that is what the word, rule or convention says. Not tested, not believed. As an argument: a definition, a convention.",
  "id": "w0027",
  "added": "2026-09-14"
 },
 {
  "form": "시",
  "pos": "root",
  "gloss": "know by belief",
  "sense_notes": "Knowing carve, side 3 of 3: held to be so without test or definition. Covers English believe, assume, take for granted. As an argument: a belief.",
  "id": "w0028",
  "added": "2026-09-14"
 },
 {
  "form": "내",
  "pos": "root",
  "gloss": "mistake",
  "sense_notes": "Error carve, side 1 of 3: a wrong act by someone. The person erred. Not the fault it may have left in the thing (side 2), not what happened at run time (side 3).",
  "id": "w0029",
  "added": "2026-09-14"
 },
 {
  "form": "노",
  "pos": "root",
  "gloss": "fault",
  "sense_notes": "Error carve, side 2 of 3: a wrong state in the thing itself, present whether or not anything has gone wrong yet. English bug, defect. Verbal: to be faulty.",
  "id": "w0030",
  "added": "2026-09-14"
 },
 {
  "form": "누",
  "pos": "root",
  "gloss": "failure",
  "sense_notes": "Error carve, side 3 of 3: something went wrong when it ran or was used. The event, not its cause. English crash, fail, error at run time. Verbal: to fail.",
  "id": "w0031",
  "added": "2026-09-14"
 },
 {
  "form": "차",
  "pos": "root",
  "gloss": "ask for information",
  "sense_notes": "Asking carve, side 1 of 3: a request to be told something. Same consonant family as the question particle. Not a request for action (side 2), not a check (side 3).",
  "id": "w0032",
  "added": "2026-09-14"
 },
 {
  "form": "체",
  "pos": "root",
  "gloss": "ask for action",
  "sense_notes": "Asking carve, side 2 of 3: a request that someone do something. English please, could you, request. Never a question about facts.",
  "id": "w0033",
  "added": "2026-09-14"
 },
 {
  "form": "치",
  "pos": "root",
  "gloss": "check an assumption",
  "sense_notes": "Asking carve, side 3 of 3: asking whether something taken as so actually holds. English confirm, verify with someone, sanity-check. The answer is a stance or evidential.",
  "id": "w0034",
  "added": "2026-09-14"
 },
 {
  "form": "라",
  "pos": "root",
  "gloss": "fix",
  "sense_notes": "Change carve, side 1 of 3: change what is broken so that it works. Presupposes a fault or failure. Not alter (side 2), not build (side 3).",
  "id": "w0035",
  "added": "2026-09-14"
 },
 {
  "form": "레",
  "pos": "root",
  "gloss": "alter",
  "sense_notes": "Change carve, side 2 of 3: change what already works into something else that works. English modify, update, refactor, tweak. Nothing was broken.",
  "id": "w0036",
  "added": "2026-09-14"
 },
 {
  "form": "리",
  "pos": "root",
  "gloss": "build",
  "sense_notes": "Change carve, side 3 of 3: bring into existence what was not there. English make, create, write from scratch, implement. As an argument: a thing built.",
  "id": "w0037",
  "added": "2026-09-14"
 },
 {
  "form": "와",
  "pos": "root",
  "gloss": "experiment, test, try",
  "sense_notes": "Lumped root (D35): the act of doing something in order to observe what happens. One root for lab experiment, unit test, and trying a thing to see. The evidential carries the result. As an argument: a test, an experiment, an attempt.",
  "id": "w0038",
  "added": "2026-09-14"
 },
 {
  "form": "야",
  "pos": "root",
  "gloss": "what, which",
  "sense_notes": "The one interrogative root. Bare: what. Before a root as a determiner: which (D44). With location case: where. With 'for': why. With 'with': how, by what means. With the time root: when. With the person root: who. There are no other question words.",
  "id": "w0039",
  "added": "2026-09-14"
 },
 {
  "form": "예",
  "pos": "root",
  "gloss": "person",
  "sense_notes": "A human. Verbal use: to be a person, to be someone. With the interrogative before it: who.",
  "id": "w0040",
  "added": "2026-09-14"
 },
 {
  "form": "다",
  "pos": "root",
  "gloss": "run",
  "sense_notes": "Make something go: execute a program, start a process, operate a machine. Not moving on foot; that is not in the language yet.",
  "id": "w0041",
  "added": "2026-09-14"
 },
 {
  "form": "데",
  "pos": "root",
  "gloss": "read",
  "sense_notes": "Take in what is written or displayed. As an argument: a reading, a read.",
  "id": "w0042",
  "added": "2026-09-14"
 },
 {
  "form": "워",
  "pos": "root",
  "gloss": "write",
  "sense_notes": "Put down in writing or in code. As an argument: a piece of writing, code written.",
  "id": "w0043",
  "added": "2026-09-14"
 },
 {
  "form": "위",
  "pos": "root",
  "gloss": "look",
  "sense_notes": "Direct attention at; examine, inspect. Does not imply finding anything. As an argument: a look, an inspection.",
  "id": "w0044",
  "added": "2026-09-14"
 },
 {
  "form": "웨",
  "pos": "root",
  "gloss": "find",